description,create_local,create_init_file,create_init_code,evaluation_check,evaluation_check1,evaluation_check2,evaluation_check_language,evaluation_check_file,evaluation_check_code,evaluation_check1_language,evaluation_check1_code,evaluation_check2_language,evaluation_check2_code,evaluation_example_file,evaluation_example_code,explanation,labels,start,evaluation_match
"As a student, you are required to calculate the total number of lines in all the '.txt' files in a given directory and its sub-directories. You need to ensure you only count '.txt' files and ignore any other file types or directories. Once you have the answer, submit your result as an integer.",,,,,,,python,check/integer-match.py,,,,,,,,"To solve this problem, you can use the 'find' command to locate all '.txt' files in the given directory and its sub-directories. Then, you can use the 'wc -l' command to count the total number of lines in all these '.txt' files. Make sure to only count the lines from the '.txt' files and ignore other file types.",,,
"As a student, you will explore and analyze the Linux (Ubuntu) operating system's file system. Your goal is to write a bash script that counts the number of files and directories in a given path, ignoring hidden files and directories. After counting, return the sum of file and directory counts as an integer.",,,,,,,python,check/integer-match.py,,,,,,,,"To solve this problem, you can use various Linux command-line utilities like ""find"" to search for files and directories in a given path. You can exclude hidden files and directories by applying filters like ""grep"" with a regex pattern. After retrieving the total counts, you can use arithmetic operations in bash to sum the counts and output the result.",,,
"As a student, your goal is to find the total number of occurrences of a given word within a set of text files in different directories. You are provided with a directory containing multiple text files, as well as subdirectories containing text files. The word to be searched is ""Linux"". Your answer should be the total number of occurrences of the word ""Linux"" across all the text files in the entire directory structure (including subdirectories). Make sure you only count exact matches and that the word is treated as case-sensitive.",,,,,,,python,check/integer-match.py,,,,,,,,"In order to solve this problem, you have to use various Linux commands, which might include find, grep, and wc. First, you need to search for all text files within the directory and its subdirectories. Then, you can use grep to search for the word ""Linux"" in each file. Lastly, you can count the number of occurrences of the word ""Linux"" within each file by using wc and sum up the counts from all the files.",,,
"As a Linux (Ubuntu) user, your task is to create a script that counts the total storage used by all regular files within the ""/var/log"" directory, in kilobytes. Your output should be an integer representing the total storage used by all these files in kilobytes.",,,,,,,python,check/integer-match.py,,,,,,,,"To solve this problem, first, use the find command to filter the regular files in the ""/var/log"" directory. Then, use du command to calculate the storage used by each of these files. Finally, sum up the storage values for all the files.

Hint: You can use pipes and xargs with the find and du commands, to make your script more elegant and efficient. To get the sum of values in a column, you can use awk.",,,
"As a Linux student, you are tasked with calculating the total size of all `.txt` files within a specified directory and its subdirectories. The answer should be in kilobytes (KB) and rounded down to the nearest integer value. Assume that all directories and files have read permissions.",,,,,,,python,check/integer-match.py,,,,,,,,"To solve this problem, you can use the `find` command to locate all `.txt` files within the specified directory and its subdirectories. You can then use a combination of commands, such as `stat`, `awk`, and `bash`, to calculate the total size of all these files and convert the result to kilobytes.",,,
"In this problem, you are required to find the total number of files and directories in a given directory and its subdirectories. The given directory will be initialized by the provided script and will contain a mixture of files and directories (including hidden files and directories). Your task is to write a bash script that prints the total count of all files and directories present inside the given directory, including its subdirectories.",,,,,,,python,check/integer-match.py,,,,,,,,"To solve this problem, you can use the `find` command in Linux to search for files and directories. You can use various options and flags provided by the `find` command to search for specific types of files and directories.

Hint: Use the find command with -type flag to specify whether to look for files or directories, and remember to consider hidden files and directories as well.",,,
"As a Linux system administrator, you are required to find out the total number of files within a given directory including all its subdirectories. The directory structure will be provided in the initialization bash script. You need to write a bash script that counts the total number of files and returns the answer as an integer.",,,,,,,python,check/integer-match.py,,,,,,,,"To solve this problem, you can use the 'find' command to search and list all the regular files under the given directory recursively. Then, you can pipe the output to the 'wc' command which counts the number of lines, words, or characters, with the `-l` flag to count the number of lines (i.e., the number of files in this case).",,,
"As a student, you are tasked to calculate the total size of files with a specific extension in a given directory and its subdirectories. You need to find the sum of these file sizes in bytes. The files extension and the directory path will be provided to you as input.

Note: You should only consider regular files, not symbolic links.",,,,,,,python,check/integer-match.py,,,,,,,,"To solve this problem, you can use the `find` command to list all the files with the specified extension inside the given directory and its subdirectories. Then, `stat` command can be utilized to retrieve the size of each file in bytes. After that, you can use command substitution and the `awk` utility to sum up all the sizes.",,,
"As a student, you are required to calculate the total size of all regular files within a specific directory, in bytes. The directory will be created by the initialization script and it will contain several files and subdirectories; however, you should only consider regular files present in the main directory, and ignore files inside subdirectories.

Create a bash script to calculate the sum of sizes of the regular files in the given directory, 'sample_directory'. The script should output a single integer representing the total size.",,,,,,,python,check/integer-match.py,,,,,,,,"To solve this problem, the students are expected to use various Linux commands like 'ls', 'awk', 'find', etc., in their script. One way to approach this would be by using the 'find' command to list only the regular files present in the main directory and then using 'stat' to obtain the size of each file. The file sizes can then be summed up using 'awk' and printed as a single integer.",,,
"In this task, you are required to calculate the total number of lines of code (LOC) written in Python (.py) files in a given directory and its subdirectories. The directory will be provided through the initialization script and will contain several Python files and subdirectories with Python files. Note that the directory and file structure may change with each new experiment. Your task is to interact with the Linux shell and find the total LOC in all Python files within the directory and its subdirectories.",,,,,,,python,check/integer-match.py,,,,,,,,"To solve this problem, you must use the `find` command to search for all `.py` files in the given directory and its subdirectories. Then, use the `wc` command with the `-l` option to count lines for each file. Finally, sum the total number of lines in all files.

Hint: Use the `find` command with the `exec` option to execute the `wc` command on each file, then pipe the output to `awk` or any other text processing utility to sum the individual line count values.",,,
"As a student, your task is to determine the total number of files and directories under the `/etc` directory in your Linux operating system (Ubuntu). Your answer should be a single integer, representing the sum of the total number of files and directories.

Note: Do *not* include the `/etc` directory itself in your count. Only count the files and directories directly under the `/etc` directory.",,,,,,,python,check/integer-match.py,,,,,,,,"To solve this problem, you need to use the `find` command to search for files and directories within the `/etc` directory. You should use appropriate options for the `find` command to ensure you are only counting files and directories directly under the `/etc` directory. Finally, you can use `wc -l` to count the number of lines returned by the `find` command, which in this case will translate to the number of files and directories.",,,
"As a student, you are asked to create a simple system analytics tool that will demonstrate your knowledge of the Linux operating system. You are to find the sum of the total number of processes and the number of logged-in users on the system. The answer must be an integer.

To help you achieve this, you can start by identifying the number of processes currently running on the system, and then find the number of users currently logged into the system. Following that, add the two numbers to get the final result.",,,,,,,python,check/integer-match.py,,,,,,,,"In order to determine the number of processes and the number of logged-in users on the system, you can use the 'ps' and 'who' commands respectively. The 'ps' command displays information about active processes, and the 'who' command displays which users are currently logged in.

Hints:
1. Use 'ps -e' to display all of the active processes on the system.
2. Use 'who' to display the logged-in users list.
3. Use 'wc -l' to count the number of lines in the output, which will give you the number of processes or users.
4. Perform arithmetic operations using expr or other arithmetic expressions in shell to sum up the process count and logged-in users count.",,,
"You have just joined a Linux system administration team, and one of the tasks assigned to you is to analyze and store log files generated by various applications. You should do the following:

1. Write an initialization script that will create a directory named ""log_files"" and will generate 10 log files (log1.log to log10.log) within this directory. Each log file should contain between 5-10 lines with randomly generated timestamps followed by a log message (e.g., ""2022-03-02 15:30:45 Connection established"").
2. Write a code snippet that, when executed, calculates the total number of lines across all log files in the ""log_files"" directory. Return this number (an integer) as the final output.",,,,,,,python,check/integer-match.py,,,,,,,,"You can solve the problem by:
1. Using a loop to create the log files and generate random timestamps with log messages in them.
2. Utilizing the `wc` utility to count the lines in all log files and `awk` to sum up the results.",,,
"For this problem, you need to determine the total number of lines, words, and characters in all text files within a specific directory and its subdirectories in the Linux operating system. You will perform this task using the 'find' and 'wc' commands in the shell.

Given a directory path ""/home/user/project"", determine the total number of:

1. Lines (L)
2. Words (W)
3. Characters (C)

in all text files (*.txt) within the given directory and its subdirectories. Your final answer should be in the format: L + W + C.",,,,,,,python,check/integer-match.py,,,,,,,,"To solve this problem, you can use the 'find' command to search for all text files within the given directory and its subdirectories. Then, use the 'wc' command to count the lines, words, and characters in these files.

For counting the lines, words, and characters, you can use the following 'wc' command options: '-l' for lines, '-w' for words, and '-m' for characters.",,,
"As a student using the Linux operating system (Ubuntu), your task is to count the total number of files and directories in a given directory tree (including the root directory). The given directory contains a mix of files and directories, including hidden ones (those starting with a period, .).

Your challenge is to create and execute a bash script that will calculate the total file count and then output that count as a single integer. You should ignore symbolic links, sockets, and other file types in your count.",,,,,,,python,check/integer-match.py,,,,,,,,"To solve this problem, you can make use of the `find` command in Linux. The `find` command searches for files and directories based on specific conditions. You can use the `-type` option to search for a particular file type (like `-type d` for directories or `-type f` for files). To include hidden files/folders in your search, you can use the `-not -path` option with the appropriate pattern. To count the number of files and directories, you can pass the results from the `find` command to the `wc` command using a pipe (`|`), and use the `-l` option to count the number of lines.",,,
"As a student, you have been given a directory called ""logs"" containing multiple files. Each file contains lines representing status messages and logged events. You need to analyze these log files and answer the following question:

How many times the keyword ""ERROR"" appears across all the files in the ""logs"" directory?

In order to accomplish this task, you must create a single command line solution that processes the log files and returns the total count of occurrences of the keyword ""ERROR"" in the ""logs"" directory. Remember, the output must only contain a single integer representing the count of occurrences.",,,,,,,python,check/integer-match.py,,,,,,,,"To solve this problem, you can use a combination of shell commands:

1. Use 'grep' with the '-o' option, which will print only the matching part of the lines, and search for the keyword ""ERROR"".
2. Pipe the output to 'wc -l' to count the number of lines, which will represent the total number of occurrences of the keyword ""ERROR"".",,,
"In this problem, you need to find the total number of lines containing the word ""Linux"" in all the "".txt"" files inside a given directory and its subdirectories.

Here's the problem detail:

1. A new directory named ""Linux_files"" will be created in your home directory.
2. The ""Linux_files"" directory will contain multiple "".txt"" files and subdirectories.
3. Some of the subdirectories inside ""Linux_files"" will also contain "".txt"" files.
4. Some of the "".txt"" files will contain the word ""Linux"" in one or more lines.
5. Your task is to find the total number of lines containing the word ""Linux"" in all the "".txt"" files inside the ""Linux_files"" directory and its subdirectories.

Submit your answer as an integer.",,,,,,,python,check/integer-match.py,,,,,,,,"To solve this problem, you can use the 'grep' command along with '-r' and '-c' options. The '-r' option is used for a recursive search to include subdirectories, and the '-c' option is used for counting occurrences.

Use the following command to search for ""Linux"" word recursively and count the occurrences:

grep -r -c 'Linux' Linux_files/*.txt

Then, use 'awk' to sum these numbers and get the total count.",,,
"As a student, your task is to find the total number of files and directories in a given directory, excluding its subdirectories. Use the Linux command line to accomplish this task and submit your answer as an integer.",,,,,,,python,check/integer-match.py,,,,,,,,"To solve this problem, you need to use a combination of commands and tools like 'find', 'wc', and pipes. First, you can use the 'find' command with the 'maxdepth' option to search for files and directories within the given directory without going into subdirectories. Then pipe the results into 'wc' with the '-l' option to count the total number of lines in the output. Finally, subtract 2 from the total number of lines, as the 'find' command will also return the given directory and the current directory. The final result will be an integer representing the total number of files and directories in the given directory, excluding its subdirectories.",,,
"As a student, you have been assigned a task to analyze the files in a directory and provide useful statistics. Your goal is to determine the total number of lines contained in all the "".txt"" files in the ""/home/student/files"" directory and its subdirectories.

Please provide your answer in the form of an integer, representing the sum of lines present in all "".txt"" files.",,,,,,,python,check/integer-match.py,,,,,,,,"To solve this problem, you may use the ""find"" command to list all the "".txt"" files in the given directory and its subdirectories. Then, you can use the ""wc"" command with the ""-l"" (lines) option to count the number of lines in each file. Finally, sum up the number of lines in all the files to get the desired result.",,,
"You are given a directory named 'log_files' which contains multiple log files. Each log file is named in the format 'log_server_X_YYYY-MM-DD.txt' where X is an integer server ID (between 1 and 100) and YYYY-MM-DD is the date. The content of each log file contains different integers, one integer per line. Your task is to find the sum of the integers present on the log files whose server ID is a prime number and was created within the last 7 days.

Write a bash script to calculate the required sum of integers and output the result.",,,,,,,python,check/integer-match.py,,,,,,,,"To solve this problem, you can follow these steps:

1. Figure out when the ""last 7 days"" were, using date command.
2. Write a small snippet to check if a number (server id) is prime.
3. Use a for loop to iterate through the log_files in the directory.
4. Use grep and awk to extract the server ID and date from the file name.
5. Check if the extracted server ID is prime and if the file is created within the last 7 days; if so, read the content and sum up all the integers in the log file.
6. Print the final calculated sum.",,,
"As a Linux user, you have to analyze the log files to keep track of the activities within a system. In this scenario, you have a log file named ""system_logs.log"" which records specific activities on your Linux (Ubuntu) operating system. The log file contains multiple lines of data with a timestamp, event type (error or_success), user ID, and action message.

Here's an example of a log entry: 
`2022-11-15 18:03:23 error 28 Directory_not_found`

The user ID is an integer (between 1 and 50), and the number of error events varies.

Your task is to create a script that counts the total number of error events in the log file for a specific user ID, provided as an input argument.

The output should be a single integer representing the total number of error events.",,,,,,,python,check/integer-match.py,,,,,,,,"To solve this problem, you can use a combination of Linux commands, including `grep`, `awk`, and `wc`. First, filter the log file for lines containing the ""error"" event type. Next, further filter the result to match the user ID provided as an argument. Finally, count the number of lines to determine the total number of error events for the specific user ID.",,,
"As a Linux user, you are required to find the total number of unique characters in a given log file. The file does not have any newline characters. The purpose of this problem is to identify your understanding of file management and text processing using command line.

**Instructions:**

1. In your Linux (Ubuntu) operating system initialize a file called `logfile.txt`.

2. Count and print the number of unique characters in the `logfile.txt` file. The result must be an integer.",,,,,,,python,check/integer-match.py,,,,,,,,"To solve this problem, you will need to use several Linux command line utilities to manipulate the text in the `logfile.txt` file. Here are some hints to help you:

1. Use `fold` command to remove newline characters (if any) in the file
2. Use `grep`, `tr` or `sed` command to eliminate duplicates
3. Use `wc` command to count characters",,,
"As a student, your task is to determine how many lines of code (LOC) are written in the C programming language within a given directory structure. This directory structure contains multiple subdirectories and files with different programming languages.

You need to count the number of lines in all .c files present in the given directory and its subdirectories; your answer must be an integer.

Note: You are only allowed to use the Linux command line and its utilities; you cannot use any other scripts or software to perform this task.",,,,,,,python,check/integer-match.py,,,,,,,,"To solve this problem, the student can use a combination of basic command-line utilities like `find`, `grep`, `wc`, and pipes.

1. Utilize the `find` command to list all .c files in the given directories and subdirectories.
2. Use `grep` with the '-c' option to count the number of lines of code (LOC) in each .c file.
3. Then, use pipes to combine these output results and sum them up with a small AWK script.
4. Finally, the output will show the total number of LOC in the .c files in the given directory, including subdirectories.",,,
"In this problem, you need to analyze the file system usage (in kilobytes) in a Linux operating system. You will be given a directory in the initialization phase. You need to find out the total number of kilobytes used by all files within that directory (including subdirectories).

Your task is to calculate the total file size in kilobytes within the provided directory, ignoring the sizes of any folders. The answer should be an integer value.",,,,,,,python,check/integer-match.py,,,,,,,,"To solve this problem, you can use the `du` command to estimate file space usage. You can also use the `-s`, `-b`, and `--apparent-size` flags to display only the total size of the given directory and obtain sizes in bytes. You may calculate the file sizes in kilobytes by dividing the total bytes by 1024, rounding up to the nearest integer.",,,
"There's a program that writes 'succeed' into /root/log periodically. I only know the interval is 1 second, 2 seconds, or 3 seconds. Please find out the interval. Answer me only the integer number of seconds. (e.g. 1, 2, or 3)",default,,,,,,,,,,,,,,,,"['file', 'process', 'background']","python3 -c 'import time
while True:
	with open(""/root/log"", ""a+"") as f:
		f.write(""succeed"")
	time.sleep(1)' &",1
There's a program that writes something into /root every 1 second. I want to know what is the file. tell me the filename please. (without its directory),default,,mkdir /root/r1 && mkdir /root/r2 && touch /root/a.log && touch /root/b.log && touch /root/log && touch /root/loga && touch /root/log.jsonl,,,,,,,,,,,,,,"['file', 'process', 'background']","python3 -c 'import time
while True:
	with open(""/root/log"", ""a+"") as f:
		f.write(""succeed"")
	time.sleep(1)' &",log
There's a program that writes something into /root every 1 second. I want to know what is the file. tell me the filename please. (without its directory),default,,mkdir /root/r1 && mkdir /root/r2 && touch /root/a.log && touch /root/b.log && touch /root/log && touch /root/loga && touch /root/log.jsonl && touch /root/r1/.plain.log,,,,,,,,,,,,,,"['file', 'process', 'background']","python3 -c 'import time
while True:
	with open(""/root/r1/.plain.log"", ""a+"") as f:
		f.write(""succeed"")
	time.sleep(1)' &",.plain.log
"I would like to implement the following function: entering the ""calc"" command will enable the calculation of an expression. The expression can include addition, subtraction, multiplication, division, and parentheses. If the absolute error between the calculated answer and the expected answer is less than 1e-5, it will be considered correct. For example, I can calculate the result by entering ""calc 2 * (9 / 3)"", and the output will be 6.",default,,,,,,,check/0.sh,,,,,,example/0.sh,,,['command'],,
"There's a program that writes 'succeed' into /root/log periodically. I only know the interval is 1 second, 2 seconds, or 3 seconds. Please find out the interval. Answer me only the integer number of seconds. (e.g. 1, 2, or 3)",default,,,,,,,,,,,,,,,,"['file', 'process', 'background']","python3 -c 'import time
while True:
	with open(""/root/log"", ""a+"") as f:
		f.write(""succeed"")
	time.sleep(3)' &",3
"I would like to implement the following function: entering the ""calc"" command will enable the calculation of an expression. The expression can include addition, subtraction, multiplication, division, and parentheses. If the absolute error between the calculated answer and the expected answer is less than 1e-5, it will be considered correct. For example, I can calculate the result by entering ""calc 2 * 1"", and the output will be 2.",default,,,,,,,check/0.sh,,,,,,example/0.sh,,,['command'],,
How many hidden files are in /home? (not including subdirectories),default,,"mkdir -p /home
echo 123>/home/.tmp
echo 123>/home/.tmp2
echo 123>/home/.tm12p
echo 123>/home/.f
echo 123>/home/.u
echo 123>/home/.k
",,,,python,check/integer-match.py,,,,,,,"ls -a /home | grep ""^\."" | wc -l",,['file'],,
