description,create_local,create_init_file,create_init_code,evaluation_check,evaluation_check1,evaluation_check2,evaluation_check_language,evaluation_check_file,evaluation_check_code,evaluation_check1_language,evaluation_check1_code,evaluation_check2_language,evaluation_check2_code,evaluation_example_file,evaluation_example_code,explanation,labels,start,evaluation_match
Stock logs are shown in /usr/stock.log. The last two columns are stock index and count. Tell me how many times Alice sold a stock.,default,init/stock-log.sh,,,,,python,check/integer-match.py,,,,,,,"grep ""Alice | Sell"" /usr/stock.log | wc -l",,"['log', 'file']",,
Stock logs are shown in /usr/stock.log. The last two columns are stock index and count. Tell me how many times Bob bought a stock.,default,init/stock-log.sh,,,,,python,check/integer-match.py,,,,,,,"grep ""Bob | Purchase"" /usr/stock.log | wc -l",,"['log', 'file']",,
"Stock logs are shown in /usr/stock.log. The last two columns are stock index and count. Please count the total number of stocks that Alice bought, and tell me the number.",default,init/stock-log.sh,,,,,python,check/integer-match.py,,,,,,,"grep ""Alice | Purchase"" /usr/stock.log | awk -F '|' '{sum += $NF} END {print sum}'",,"['log', 'file']",,
Stock logs are shown in /usr/stock.log. The last two columns are stock index and count. Please determine the number of types of stocks Bob sold. And tell me the answer.,default,init/stock-log.sh,,,,,python,check/integer-match.py,,,,,,,"grep ""Bob | Sell"" /usr/stock.log | awk -F '|' '{print $3}' | sort -u | wc -l",,"['log', 'file']",,
Stock logs are shown in /usr/stock.log. The last two columns are stock index and count. Please count the number of types of stocks that Bob sold but never bought. And tell me the answer.,default,init/stock-log.sh,,,,,python,check/integer-match.py,,,,,,,"grep ""Bob | Sell"" /usr/stock.log | awk -F '|' '{print $3}' | sort | uniq > bob_sold.txt; grep ""Bob | Purchase"" /usr/stock.log | awk -F '|' '{print $3}' | sort | uniq > bob_bought.txt; comm -23 bob_sold.txt bob_bought.txt | wc -l; rm bob_sold.txt bob_bought.txt",,"['log', 'file']",,
Stock logs are shown in /usr/stock.log. The last two columns are stock index and count. Identify the most active traders (buyers/sellers) based on the count of their transactions.,default,init/stock-log.sh,,,,,python,check/string-match.py,,,,,,,awk -F '|' '{print $1}' /usr/stock.log | sort | uniq -c | sort -nr | head -n 1 | awk '{print $2}',,"['log', 'file']",,
Stock logs are shown in /usr/stock.log. The last two columns are stock index and count. Find the stock index with the highest count of transactions (combined purchases and sales).,default,init/stock-log.sh,,,,,python,check/string-match.py,,,,,,,awk -F '|' '{a[$3]++} END {max=0; for (stock in a) {if (a[stock] > max) {max = a[stock]; stockIndex = stock}} print stockIndex}' /usr/stock.log,,"['log', 'file']",,
Tell me how many files can be executed in PATH.,,,,,,,python,check/integer-match.py,,,,,,,,,['environment'],,
Tell me how many files can be executed directly no matter where my work dir is.,,,,,,,python,check/integer-match.py,,,,,,,,,['environment'],,
"I remember I had a directory for executables, and there was an executable echo-love in there. But I forgot the path of this directory. Can you tell me the full path of this directory?",default,init/nested_folders.sh,,,,,python,check/string-match.py,,,,,,,,,['environment'],,
"I remember I had a directory for executables, and there was an executable echo-love in there. But I forgot the path of this directory. Can you tell me the full path of this executable?",default,init/nested_folders.sh,,,,,python,check/string-match.py,,,,,,,,,['environment'],,
"I remember I had a directory for executables, and there was an executable echo-love in there. But I forgot the path of this directory. Can you add the folder into PATH so that I can call it in the future?",default,,,"source ~/.bashrc && x=$(echo-love) && [ ""$x"" == ""I love myself."" ] && exit 0",,,,,,,,,,,,,['environment'],,
Tell me the number of CPUs.,,,,,,,python,check/integer-match.py,,,,,,,,,"['command', 'CPU', 'device', 'hardware', 'processor', 'system']",,
How many groups are in this UNIX system?,,,,,,,python,check/integer-match.py,,,,,,,,,"['command', 'system']",,
Recursively Find how many files have the extension .tep,default,,,,,,python,check/integer-match.py,,,,,,,,,"['command', 'file']",,
"Tell me whether npm is installed or not. If it is installed, return 'yes'. If it is not installed, return 'no'",,,,,,,python,check/string-match.py,,,,,,,,,"['command', 'packages']",,
"Tell me whether npm is installed or not. If it is installed, return 'yes'. If it is not installed, return 'no'",packages,,,,,,python,check/string-match.py,,,,,,,,,"['command', 'packages']",,
Tell me the max number of threads in Linux.,,,,,,,python,check/string-match.py,,,,,,,,,"['command', 'file']",,
"How many hidden files, which do not contain the character u, are in /usr? (not recursively)",default,,,,,,python,check/integer-match.py,,,,,,,"find /usr -type f -name "".*"" -not -name ""*k*""  | wc -l",,['file'],,
execute ~/test and get the output.,,,,,,,,,,,,,,,chmod 777 test && ~/test,,"['permission', 'user']",useradd -s /bin/bash -d /home/jack -m jack && cd /home/jack && echo 'echo love' > test && chmod 000 test && chown jack test && su - jack,love
"What's the full path of a file ""TOOLS""?",default,,,,,,python,check/string-match.py,,,,,,,,,"['path', 'file']",,
"If a regular file named ""workspace"" exists in /working (recursively)? If so, output ""yes"", otherwise output ""no"" (with out quotes).",default,,,,,,,,,,,,,,,,['file'],,no
"If a regular file named ""workspace"" exists in /working (recursively)? If so, output ""yes"", otherwise output ""no"" (with out quotes).",default,,,,,,,,,,,,,,,,['file'],,no
"If a regular file named ""workspace"" exists in /working (recursively)? If so, output ""yes"", otherwise output ""no"" (with out quotes).",default,,,,,,,,,,,,,,,,['file'],,yes
"If a regular file named ""workspace"" exists in /working (recursively)? If so, output ""yes"", otherwise output ""no"" (with out quotes).",default,,,,,,,,,,,,,,,,['file'],,yes
Get the name of most recent file in /usr. (not recursively),default,,,,,,python,check/string-match.py,,,,,,,ls -lt /usr | head -n 2 | tail -n 1 | awk '{print $9}',,['file'],,
What is the total number of files in the /var directory? (recursively),default,,,,,,python,check/integer-match.py,,,,,,,find /var -type f | wc -l,,"['command', 'file']",,
How many lines are there in /root/matrix.txt,default,,,,,,python,check/integer-match.py,,,,,,,cat /root/matrix.txt | wc -l,,"['command', 'file']",,
How many default paths are looked for when I execute an executable on this computer? (Regardless of whether the path exists or not.),default,,,,,,python,check/integer-match.py,,,,,,,source ~/.bashrc; echo $PATH | tr ':' '\n' | wc -l,,"['command', 'variables']",,
How many default paths are looked for when I execute an executable on this computer? (Only existing and valid directories),default,,,,,,python,check/integer-match.py,,,,,,,"source ~/.bashrc; count=0; IFS=:; for path in $PATH; do [ -d ""$path"" ] && ((count++)); done; echo $count",,"['command', 'variables']",,
How many default paths are looked for when I execute an executable on this computer? (Only existing and valid directories),default,,,,,,python,check/integer-match.py,,,,,,,"source ~/.bashrc; count=0; IFS=:; for path in $PATH; do [ -d ""$path"" ] && ((count++)); done; echo $count",,"['command', 'variables']",,
How many paths are in $PATH? (Regardless of whether the path exists or not.),default,,,,,,python,check/integer-match.py,,,,,,,source ~/.bashrc; echo $PATH | tr ':' '\n' | wc -l,,"['command', 'variables']",,
How many existing directories are in $PATH?,default,,,,,,python,check/integer-match.py,,,,,,,"source ~/.bashrc; count=0; IFS=:; for path in $PATH; do [ -d ""$path"" ] && ((count++)); done; echo $count",,"['command', 'variables']",,
How many existing directories are in $PATH?,default,,,,,,python,check/integer-match.py,,,,,,,"source ~/.bashrc; count=0; IFS=:; for path in $PATH; do [ -d ""$path"" ] && ((count++)); done; echo $count",,"['command', 'variables']",,
Move the file MyPersonalComputer.config to current directory. And tell me the path of the file before copying.,default,,,,,,python,,"from sys import argv
assert argv[1].strip()=='/home/user1/os/linux/commands/MyPersonalComputer.config'",bash,find /home/user1/os/linux/commands/MyPersonalComputer.config >/dev/null 2>/dev/null && exit 1 || exit 0,bash,find /home/user2/MyPersonalComputer.config >/dev/null 2>/dev/null && exit 0 || exit 1,,mv /home/user1/os/linux/commands/MyPersonalComputer.config /home/user2/ && echo /home/user1/os/linux/commands/MyPersonalComputer.config,,"['path', 'files']",mkdir /home/user2 && cd /home/user2,
"Test if variable var is an integer? If so, tell me ""yes"", otherwise tell me ""no"". (Without quotes)",default,,,,,,,,,,,,,,"test ""$var"" -eq ""$var"" 2>/dev/null && echo ""yes"" || echo ""no""",,"['command', 'variables']",var=3.14,no
"Test if variable var is an integer? If so, tell me ""yes"", otherwise tell me ""no"". (Without quotes)",default,,,,,,,,,,,,,,"test ""$var"" -eq ""$var"" 2>/dev/null && echo ""yes"" || echo ""no""",,"['command', 'variables']",var=10,yes
"I would like to implement the following function: entering the ""calc"" command will enable the calculation of an expression. The expression can include addition, subtraction, multiplication, division, and parentheses. If the absolute error between the calculated answer and the expected answer is less than 1e-5, it will be considered correct. For example, I can calculate the result by entering ""calc 6 * (9 / 3) + 7"", and the output will be 25.",default,,,,,,,checking/0.sh,,,,,,example/0.sh,,,['command'],,
"I would like to implement the following function: entering the ""count"" command will counts the number of regular files in a directory and its subdirectories(recursively), and displays the total count. If there is a link or something, count it separately. For example, I can enter ""count /usr/local"" to get the number of regular files in /usr/local recursively. If there are 5 regular files in that, the output is ""5"".",default,,,,,,,checking/1.sh,,,,,,example/1.sh,,,"['command', 'file']",,
"I would like to implement a command line tool called ""date-format"" that can format a given date string based on the provided format string. For example, if I enter command date-format 2023-5-1 '%Y/%m/%d', the output will be 2023/05/01.",default,,,,,,,checking/2.sh,,,,,,example/2.sh,,,['command'],,
How many hidden files are in /usr?,default,,"echo 123>/usr/.tmp
echo 123>/usr/.tmp2
echo 123>/usr/.tm12p
echo 123>/usr/.f
echo 123>/usr/.u
echo 123>/usr/.k
",,,,python,check/integer-match.py,,,,,,,"ls -a /usr | grep ""^\."" | wc -l",,['file'],,
How many files whose name starts with letter exist in /usr?,default,,"echo 123>/usr/tmp
echo abcd>/usr/.tmp2
echo abcdabcd>/usr/.tm12p
echo abcdabcdabcdabcd>/usr/f
echo abcdabcdabcdabcdabcdabcdabcdabcd>/usr/.u
echo abcdabcdabcdabcdabcdabcdabcdabcdabcdabcdabcdabcd>/usr/.k
",,,,python,check/integer-match.py,,,,,,,"ls -1  | grep ""^[[:alpha:]]"" | wc -l",,['file'],,
How much disk space is being used by /usr and all of its contents? Tell me in human-readable format.,default,,"echo ""This is a random string: wuafjva-niqt12r-j9asd19-afj12-sdmxai"">/usr/OSbench
",,,,python,check/size-match.py,,,,,,,du -sh /usr | awk '{print $1}',,['file'],,
How many empty files are there in /usr and all of its content?,default,,"echo ""This is a random string: wuafjva-niqt12r-j9asd19-afj12-sdmxai"">/usr/OSbench
touch /usr/tmpfile
mkdir /usr/tmpdir
touch /usr/tmpdir/inner",,,,python,check/integer-match.py,,,,,,,find /usr -type f -size 0 | wc -l,,['file'],,
How many directories are in the root dir (excluding hidden directories)?,,,,,,,python,check/integer-match.py,,,,,,,"ls -l / | grep ""^d"" | grep -v ""^d.*\."" | wc -l",,['file'],,
How many directories (recursively) are in the /usr directory?,default,,"echo ""This is a random string: wuafjva-niqt12r-j9asd19-afj12-sdmxai"">/usr/OSbench
touch /usr/tmpfile
mkdir /usr/tmpdir
touch /usr/tmpdir/inner",,,,python,check/integer-match.py,,,,,,,find /usr -type d | wc -l,,['file'],,
How many files in /usr (recursively) were modified in the last 24 hours?,default,,"echo ""This is a random string: wuafjva-niqt12r-j9asd19-afj12-sdmxai"">/usr/OSbench
touch /usr/tmpfile
mkdir /usr/tmpdir
touch /usr/tmpdir/inner",,,,python,check/integer-match.py,,,,,,,find /usr -type f -mtime -1 | wc -l,,['file'],,
execute ~/test and get the output,,,useradd -s /bin/bash -d /home/jack -m jack && cd /home/jack && echo 'echo a3b0c7' > test && chmod 000 test && chown jack test &&su - jack,,,,,,,,,,,,,,"['permission', 'user']",,a3b0c7
What will be the output if I execute ~/test?,,,useradd -s /bin/bash -d /home/jack -m jack && cd /home/jack && echo 'echo a3b0c7' > test && chmod 000 test && chown jack test &&su - jack,,,,,,,,,,,,,,"['permission', 'user']",,a3b0c7
"make /testfile readable to jack, bill and tom, but not george",,,echo 'test' > /testfile && useradd -s /bin/bash -d /home/jack -m jack && useradd -s /bin/bash -d /home/bill -m bill && useradd -s /bin/bash -d /home/tom -m tom && useradd -s /bin/bash -d /home/george -m george,,,,,,"(runuser -l jack -c 'cat /testfile' && runuser -l bill -c 'cat /testfile' && runuser -l tom -c 'cat /testfile' && runuser -l george -c 'cat /testfile') | if [ ""$(cat -)"" = ""test""$'\n'""test""$'\n'""test"" ]; then exit 0; else exit 1; fi",,,,,,groupadd tmp && usermod -a -G tmp jack && usermod -a -G tmp bill && usermod -a -G tmp tom && chmod 640 /testfile && chgrp tmp /testfile,,"['permission', 'user']",,
There's a vulnerability in the system (Hint: related to SUID). Find it and fix it.,,,chmod u+s /usr/bin/find,,,,,,ls -l /usr/bin/find | awk '{if ($1~/^-..s/) { exit 1; } else { exit 0; }}',,,,,,chmod u-s /usr/bin/find,,['permission'],,
"set all files in ~/videos to be 660, and all directories(include ~/videos) to be 750",,,cd ~ && mkdir videos && cd videos && mkdir old && mkdir new && touch vid1 && touch vid2 && touch new/a && touch new/b && touch old/c,,,,,,"(find ~/videos -type f ! -perm 660 -ls && find ~/videos -type d ! -perm 750 -ls) | if [ ""$(cat -)"" = """" ]; then exit 0; else exit 1; fi",,,,,,find ~/videos -type f -exec chmod 660 {} + && find ~/videos -type d -exec chmod 750 {} +,,['permission'],,
ahh! Why can't I use sudo??? Is it because the WiFi I'm using? fix it!!!,,,apt update && apt install sudo -y && echo '' > /etc/sudoers,,,,,,"sudo whoami | if [ ""$(cat -)"" = ""root"" ]; then exit 0; else exit 1; fi",,,,,,"echo 'Defaults        env_reset
Defaults        mail_badpass
Defaults        secure_path=""/usr/local/sbin:/usr/local/bin:/usr/sbin:/usr/bin:/sbin:/bin:/snap/bin""
root    ALL=(ALL:ALL) ALL
%admin ALL=(ALL) ALL
%sudo   ALL=(ALL:ALL) ALL' > /etc/sudoers",,['permission'],,
Why can't I use sudo? Help me fix it.,,,apt update && apt install sudo -y && echo '' > /etc/sudoers,,,,,,"sudo whoami | if [ ""$(cat -)"" = ""root"" ]; then exit 0; else exit 1; fi",,,,,,"echo 'Defaults        env_reset
Defaults        mail_badpass
Defaults        secure_path=""/usr/local/sbin:/usr/local/bin:/usr/sbin:/usr/bin:/sbin:/bin:/snap/bin""
root    ALL=(ALL:ALL) ALL
%admin ALL=(ALL) ALL
%sudo   ALL=(ALL:ALL) ALL' > /etc/sudoers",,['permission'],,
"Suppose you have a directory called /data that contains sensitive files that should only be accessible to members of the group ""dataaccess"". Ensure that new files and directories created in this directory inherit the group ownership, and that users can only delete files and directories that they own",,,mkdir /data,,,,,,ls -l / | grep data | awk '{if ($1~/^d.....s..t/) { exit 0; } else { exit 1; } }',,,,,,chmod g+s /data && chmod +t /data,,['permission'],,
Why can't I use sudo?? fix it.,,,apt remove sudo,,,,,,"sudo whoami | if [ ""$(cat -)"" = ""root"" ]; then exit 0; else exit 1; fi",,,,,,apt update && apt install sudo -y,,['permission'],,
"The problem is related to process management in the Linux operating system. You will need to find the total number of active processes running in the user's Linux (ubuntu) operating system. 

You are required to write a bash script that counts all the active processes and displays the count as an integer value.

We will initialize the environment by creating an additional 5 processes that will run for 60 seconds each in the background.",,,,,,,python,check/integer-match.py,,,,,,,,"To solve this problem, you will need to count all the active processes using the 'ps' command by combining it with other utilities like 'grep', 'awk', or 'wc'. A hint is to use the 'ps -A' or 'ps -e' option with 'ps' command to list all the processes running in the system.",,,
"In this problem, your task is to find the total count of processes that are currently running on the student's Linux (Ubuntu) operating system having 'bash' in their command name or path. The answer must be an integer.",,,,,,,python,check/integer-match.py,,,,,,,,"To solve this problem, you can use the 'ps' command to get the list of processes and 'grep' command to filter out the desired processes containing 'bash' in their command name or path. Here are a few hints on how to construct your command:

1. Use 'ps -ef' to display the processes for all users.
2. You need to use 'grep' command to find the processes containing 'bash' in their command name/path.
3. Count the number of lines which indicates the number of matched processes.
4. You may want to combine these steps in a pipeline for the easy retrieval of the desired result.",,,
"As a student, you are required to calculate the total size of all files with a specific file extension in a given directory and its subdirectories. You have to use Linux (Ubuntu) operating system commands to achieve this. The file extension and directory path will be given to you as input arguments.",,,,,,,python,check/integer-match.py,,,,,,,,"1. First, navigate to the given directory using the 'cd' command.
2. Then, use the 'find' command to search for all files with the specified file extension.
3. Use the 'wc' and 'stat' commands to calculate the sizes of the individual files.
4. Finally, use the 'awk' command to sum up the sizes of all files.",,,
"Design a problem that challenges students to count the number of lines containing the word ""error"" in all files with the extension "".log"" in the current directory (excluding subdirectories). Count only lines where ""error"" appears and is not part of another word. For example, ""errors"" should not be counted. The output should be an integer.",,,,,,,python,check/integer-match.py,,,,,,,,"To solve this problem, students need to use various Linux commands to filter and count lines containing the word ""error"" in the specified files. They can use commands like grep, find, wc, and xargs to achieve this.

Hint: Students may want to combine the grep and find commands with xargs to filter the appropriate files and lines.",,,
"You are using a Linux operating system (Ubuntu), and your task is to find out the total number of processes that are using a specific user's UID.

In this exercise, you'll use standard Linux command-line utilities like 'ps', 'grep', and 'wc' to achieve this. Additionally, you will execute an initialization script that simulates an environment with a specific number of processes running as that specific user.

Your answer should be an integer representing the total number of processes running as that user.",,,,,,,python,check/integer-match.py,,,,,,,,"To solve this problem, you have to first run the initialization script which will create a user and spawn a certain number of processes owned by that user. Next, you will use the 'ps' command to list out the processes along with their user IDs and filter the results with 'grep' to find only the processes running as our specific user. Lastly, you will count the number of lines using 'wc' to get the total number of processes running as that user.",,,
"You are given a Linux file system with two directories named ""dir1"" and ""dir2"". Both directories contain a set of text files. Your task is to write a bash script to count the total number of lines in all the text files that reside in both ""dir1"" and ""dir2"". Please only consider the files with '.txt' extension.",,,,,,,python,check/integer-match.py,,,,,,,,"To solve this problem, you can use `find` command to locate '.txt' files in the given directories, and then use `wc` command with '-l' option to count the total number of lines in those files. Finally, sum the count of lines from both the directories.",,,
"You are given a task to monitor system usage in a Linux (Ubuntu) operating system. You are required to calculate the percentage of the available memory (in integers) that has been used on the system. To do this, you will first execute an initialization script to deploy the environment on each student's Linux system, and then execute a piece of code to produce an integer as the standard answer. Your task is to devise a problem, bash scripts for initialization, and an example script to calculate the used memory percentage.

Please keep in mind that the question description must be related to the Linux operating system and the output must only contain integers.",,,,,,,python,check/integer-match.py,,,,,,,,"To solve the problem, students should extract the total and free memory values from the 'free' command and calculate the used memory percentage with integers. An example bash script would parse this information and calculate the result.

Students might also want to explore the 'free' command and how to manipulate text output using tools like 'grep' and 'awk'.",,,
"Your task is to calculate the total size of all files in a given directory, including files in its subdirectories, and return the total size in bytes. The given directory is `/home/user/experiment` which contains multiple subdirectories and files of different sizes.

NOTE: You should not use any pre-built tools or commands to return the total directory size directly (e.g., `du`). You are required to find the size of each file individually and calculate the total sum. The answer must be an integer.",,,,,,,python,check/integer-match.py,,,,,,,,"To solve this problem, you can use the `find` command to list all the files recursively in the given directory. Then you can use `-exec` with `wc` or `stat` command to get the size of each file individually and parse the output to get the size in bytes. Finally, sum the sizes and output the result.",,,
"In this problem, the students should calculate the total number of files and directories (recursive) in a given directory. The directory will be created and populated with files and directories by the initialization script. During the initialization, a specific environment variable `TARGET_DIR` will be set pointing to the created directory, which should be used by the students in their command.

You need to find the total number of files and directories (recursive) in the directory pointed by `TARGET_DIR`. Use the command line to achieve this and submit your answer as an integer. ",,,,,,,python,check/integer-match.py,,,,,,,,"To solve this problem, you can use the 'find' command to search for files and directories in the given directory. The 'wc' command can be used to count lines, which represent the number of files and directories found.

Here is a hint on how you could structure your command using `find` and `wc`:

```bash
find $TARGET_DIR -type f -o -type d | wc -l
```

The above command searches for files and directories in the given target directory and counts the number of resulting lines.",,,
"In this experiment, you will be asked to find the number of lines for each type of file in a directory specified during the initialization step. You are required to find the count of lines for the following types of files: .txt, .csv, and .log. Your answer should be in the format of `TXT_COUNT CSV_COUNT LOG_COUNT`, separated by spaces.

To make it more challenging, you need to find the line count by only using a single command. You are allowed to use pipes to pass the output of one command to another if needed.

Make sure not to count empty lines or lines that only contain whitespaces (spaces or tabs).",,,,,,,python,check/integer-match.py,,,,,,,,"To solve this problem, you can use the `find` command to search for files with specified extensions (.txt, .csv, and .log), then use the `grep` command to filter out empty lines or lines containing only whitespaces, and finally use the `wc` command to count the number of lines.",,,
"In this problem, you are required to count the total number of lines and the total number of words in all '*.txt' files in your current working directory. The output should be an integer value which calculates the sum of the total number of lines and the total number of words as a single integer.

Note: Make sure to consider only '*.txt' files in the current working directory and ignore files in subdirectories.",,,,,,,python,check/integer-match.py,,,,,,,,"To solve this problem, you can use the `wc` command with the `-l` option to count the total number of lines and the `-w` option to count the total number of words in the '*.txt' files. To find and pass the '*.txt' files to the `wc` command, you can use the `find` command with the `-maxdepth` option.",,,
